{
    "schemaVersion": 1,
    "sourceLocale": "en",
    "locale": "pl",
    "entries": {
        "vape": {
            "source": "vape",
            "preferred": "vape",
            "context": "Potoczne określenie elektronicznego papierosa i sprzętu do wapowania.",
            "discouraged": ["waporyzator"],
            "state": "machine",
            "provenance": { "kind": "machine", "method": "Polskie źródła terminologii e-papierosów" },
            "confidence": "high"
        },
        "vaping": {
            "source": "vaping",
            "preferred": "wapowanie",
            "context": "Czynność używania e-papierosa; polskie źródła branżowe i słownikowe używają czasownika wapować.",
            "discouraged": ["parowanie"],
            "state": "machine",
            "provenance": { "kind": "machine", "method": "Polskie źródła językowe i branżowe" },
            "confidence": "medium"
        },
        "electronic-cigarette": {
            "source": "electronic cigarette",
            "preferred": "e-papieros",
            "context": "Standardowe polskie określenie elektronicznego papierosa.",
            "state": "machine",
            "provenance": { "kind": "machine", "method": "Polskie źródła rządowe i słownikowe" },
            "confidence": "high"
        },
        "atomizer": {
            "source": "atomizer",
            "preferred": "atomizer",
            "context": "Element e-papierosa podgrzewający liquid i wytwarzający aerozol; nie jest to interfejs ani port wyjściowy.",
            "discouraged": ["parownik"],
            "state": "machine",
            "provenance": { "kind": "machine", "method": "Polskie źródła rządowe, techniczne i unijne" },
            "confidence": "high"
        },
        "coil": {
            "source": "coil",
            "preferred": "grzałka",
            "context": "Element grzewczy atomizera; w obliczeniach oporu oznacza spiralę lub zespół grzewczy.",
            "discouraged": ["cewka", "coil"],
            "state": "machine",
            "provenance": { "kind": "machine", "method": "Polskie źródła techniczne i branżowe" },
            "confidence": "high"
        },
        "e-liquid": {
            "source": "e-liquid",
            "preferred": "liquid",
            "context": "Płyn używany w e-papierosie; polskie źródła techniczne powszechnie zachowują termin liquid.",
            "discouraged": ["sok", "płyn do wapowania"],
            "state": "machine",
            "provenance": { "kind": "machine", "method": "Polskie źródła rządowe i branżowe" },
            "confidence": "high"
        },
        "battery-drain": {
            "source": "battery drain",
            "preferred": "zużycie baterii",
            "context": "Pobór energii i prądu z baterii w wynikach kalkulatora.",
            "discouraged": ["drenaż baterii"],
            "state": "machine",
            "provenance": { "kind": "machine", "method": "Polska terminologia techniczna" },
            "confidence": "high"
        },
        "output-power": {
            "source": "output power",
            "preferred": "moc wyjściowa",
            "context": "Moc elektryczna dostarczana przez urządzenie do atomizera lub grzałki; nie oznacza ilości wytwarzanego aerozolu.",
            "discouraged": [
                "interfejs wyjściowy",
                "port wyjściowy"
            ],
            "state": "machine",
            "provenance": {
                "kind": "machine",
                "method": "GPT-6 independent Polish critique and verification against battery-calculator UI and calculation context"
            },
            "confidence": "high"
        },
        "heat-flux": {
            "source": "heat flux",
            "preferred": "gęstość strumienia ciepła",
            "context": "Moc cieplna przypadająca na jednostkę powierzchni, np. W/m² lub mW/mm².",
            "state": "machine",
            "provenance": {
                "kind": "machine",
                "model": "GPT-6",
                "method": "English-source review; Polish heat-transfer terminology verified in Politechnika Wrocławska teaching material"
            },
            "confidence": "high"
        },
        "specific-heat-capacity": {
            "source": "specific heat capacity",
            "preferred": "ciepło właściwe",
            "context": "Energia potrzebna do ogrzania jednostki masy o jeden kelwin; wielkość na jednostkę masy, np. J/g·K.",
            "state": "machine",
            "provenance": {
                "kind": "machine",
                "model": "GPT-6",
                "method": "English-source review; terminology attested by GUM thermometry laboratory: https://kampus.gum.gov.pl/laboratoria/termometrii/"
            },
            "confidence": "high"
        },
        "resistivity": {
            "source": "electrical resistivity",
            "preferred": "rezystywność",
            "context": "Właściwość materiału określająca opór właściwy, np. w Ω mm²/m; odróżniać od rezystancji gotowego drutu.",
            "state": "machine",
            "provenance": {
                "kind": "machine",
                "model": "GPT-6",
                "method": "English-source review and distinction from electrical resistance in the calculator material model"
            },
            "confidence": "high"
        },
        "resistance": {
            "source": "resistance",
            "preferred": "opór",
            "context": "Wielkość elektryczna mierzona dla grzałki; opór elektryczny i rezystancja są poprawnymi terminami.",
            "state": "machine",
            "provenance": {
                "kind": "machine",
                "model": "GPT-6",
                "method": "English-source review; GUM national resistance standard uses rezystancja and opór elektryczny: https://www.gum.gov.pl/pl/wiedza/wzorce-pomiarowe-gum/rezystancji/5787,Panstwowy-wzorzec-jednostki-miary-rezystancji.html"
            },
            "confidence": "high"
        }
    }
}
